"名称","住所","ID","住所1","住所2","住所3","電話","FAX","利用時間","階数","定休日","駐車場","敷地内の状況および施設入口","誘導施設","案内設備","昇降設備","トイレ","公衆電話","その他の設備","備考","カテゴリー","分類"
"会津川河川公園","田辺市秋津川791−1","BA555548","和歌山県","田辺市","秋津川791−1","","","終日","","","◎一般駐車場　有り：３台","","","","","","","","","その他","その他"
"かつらぎ公園","伊都郡かつらぎ町丁ノ町2530","BA555835","和歌山県","伊都郡かつらぎ町","丁ノ町2530","","","９：００〜１７：００","地上１階","","","","","","","◎障害者（車椅子）用便所　有り：１箇所（公衆用トイレ内）","","","","その他","その他"
"ふれあい会館","伊都郡かつらぎ町志賀1341-3、他","BA555836","和歌山県","伊都郡かつらぎ町","志賀1341-3、他","0736-26-9010","0736-26-9010","営業時間内","地上２階","木曜日","◎一般駐車場　有り：６６台<br>◎障害者用駐車場　有り：２台","◎施設入口への車椅子利用：可<br>◎自動ドア　有り","◎誘導ブロック　有り","","","◎障害者（車椅子）用便所　有り：１箇所<br>◎洋式大便所　有り：５箇所<br>◎手すり付便所　有り：１箇所","","","◎車椅子用トイレは１階にある","その他","その他"
"JAかつらぎ町本所総合ターミナル","伊都郡かつらぎ町大谷字大谷西出前1206-1","BA555837","和歌山県","伊都郡かつらぎ町","大谷字大谷西出前1206-1","0736-22-0550","0736-22-2870","8:30〜17:00","地上２階","土・日曜日","◎一般駐車場　有り：６０台","◎施設入口への車椅子利用：可<br>◎自動ドア　有り","◎誘導ブロック　有り","","◎１階（避難階）以外の階への一般の人の出入り　有り<br>◎一般エレベーター　有り：1400×1250（低位置操作盤・音声案内）","◎障害者（車椅子）用便所　有り：２箇所（1階2階共）<br>◎洋式大便所　有り：２箇所","","◎キャッシュコーナー　有り（時間外出入口が段差なし等）","◎駐車場は現在、未舗装です。","その他","その他"
"かつらぎ斎場","伊都郡かつらぎ町妙寺1471-17","BA555838","和歌山県","伊都郡かつらぎ町","妙寺1471-17","0736-22-6208","0736-22-6208","9:00〜17:00","地上１階","なし","◎一般駐車場　有り：９０台<br>◎障害者用駐車場　有り：２台","◎施設入口への車椅子利用：可","◎誘導ブロック　有り","◎一般案内　有り","","◎障害者（車椅子）用便所　有り：１箇所（廊下横）<br>◎洋式大便所　有り：２箇所","◎難聴者用電話　有り","◎車椅子の常備　有り：２台（待合ホール）","◎障害者便所は休憩棟の廊下横の奥にあります。","その他","その他"
"喫茶軽食ゲストハウス","橋本市高野口町伏原８８０−１","BA555839","和歌山県","橋本市","高野口町伏原８８０−１","0736-44-2136","0736-44-2136","7:00〜18:00","地上３階（店舗は１階）","","◎一般駐車場　有り：２０台<br>◎障害者用駐車場　有り：１台<br>◎大型バス　駐車可","◎施設入口への車椅子利用：可<br>◎自動ドア　有り","","","","◎障害者（車椅子）用便所　有り：１箇所<br>◎洋式大便所　有り：１箇所<br>◎手すり付便所　有り：１箇所","◎車椅子用電話　有り：１箇所","","","その他","その他"
"高野山観光協会","伊都郡高野町高野山600","BA555840","和歌山県","伊都郡高野町","高野山600","0736-56-2616","0736-56-2889","8:30〜16:30","地上２階","12/29〜12/31","◎一般駐車場　有り：２台","◎施設入口への車椅子利用：可<br>◎自動ドア　有り","","◎一般案内　有り","","","","◎車椅子の常備　有り：４台","◎従業員による介護、観光情報の提供、車イスの無料貸し出し。<br>◎宿坊での宿泊、昼食の予約手配。","その他","その他"
"中の橋会館(西)","伊都郡高野町高野山４９-３","BA555841","和歌山県","伊都郡高野町","高野山４９-３","0736-56-3713","","9:00〜17:00","地上２階","なし","","◎施設入口への車椅子利用：可","","","","椅子用便所なし","","","◎１、２階便所あり、車椅子用便所なし","その他","その他"
"中の橋会館(東)","伊都郡高野町高野山４９-３","BA555842","和歌山県","伊都郡高野町","高野山４９-３","0736-56-3713","","9:00〜17:00","地上２階","なし","","◎施設入口への車椅子利用：可","","","","◎障害者（車椅子）用便所　有り：１箇所","","","◎新中の橋会館<br>◎１階のみ車椅子用便所","その他","その他"
"城北公園地下駐車場","和歌山市西鍛冶屋町7","BA555236","和歌山県","和歌山市","西鍛冶屋町7","073-433-8141","","7:30〜22:30","地下１階","1/1〜1/3","◎一般駐車場　有り：１９６台<br>◎障害者用駐車場　有り：２台","◎施設入口への車椅子利用：可","","","◎一般用エレベーター　有り<br>◎障害者用エレベーター　有り（低位置操作盤）","◎障害者（車椅子）用便所　有り：１箇所（地下１階エレベーターホール前）<br>◎洋式大便所　有り：２箇所<br>◎手すり付便所　有り：３箇所","","","◎身障者用エレベーターで出入りできます。<br>◎身障者手帳を掲示すると、利用料金が５割引になります。","その他","その他"
"和歌山市営中央駐車場","和歌山市七番丁19","BA555237","和歌山県","和歌山市","七番丁19","073-432-5309","","24時間","地上７階、PH１階","1/1〜1/3","◎一般駐車場　有り：５７７台<br>◎障害者用駐車場　有り：７台","◎施設入口への車椅子利用：可","","","◎一般用エレベーター　有り","◎障害者（車椅子）用便所　有り：１箇所（１階エレベーター横）","","","◎車椅子の方は、エレベーターで出入りできます。<br>◎身障者手帳を掲示すると、利用料金が５割引になります。","その他","その他"
"ファーストビル","和歌山市東蔵前丁4番地","BA555238","和歌山県","和歌山市","東蔵前丁4番地","073-428-1333","073-431-0789","6:30〜23:30","地上８階、地下１階","なし","◎一般駐車場　有り：１０５台","◎施設入口への車椅子利用：可","","◎一般案内　有り","◎一般用エレベーター　有り<br>◎障害者用エレベーター　有り（低位置操作盤）","◎障害者（車椅子）用便所　有り：２箇所（3階のみ）<br>◎洋式大便所　有り：２箇所<br>◎手すり付便所　有り：１箇所","","","◎3階に医療施設が入っている為、2台のEVのうち1台をストレッチャーがはいる大きさにし、手摺低位置操作盤を設けています。<br>◎また、便所も3階のみですが、手摺付洋便器を設置し、扉もアコーディオン式としています。","その他","その他"
"和歌山ガスビル","和歌山市十一番丁1-2","BA555239","和歌山県","和歌山市","十一番丁1-2","","","9:00〜17:30","地上６階","日曜祝日","◎一般駐車場　有り<br>◎障害者用駐車場　有り：１台","◎施設入口への車椅子利用：可<br>◎自動ドア　有り","","","◎障害者用エレベーター　有り（低位置操作盤・点字表示・音声案内）","◎障害者（車椅子）用便所　有り：１箇所（店舗施設奥）","","","◎障害者Pよりは直接は店舗には入れない。正面入口より入り、誘導してもらって利用する。","その他","その他"
"和歌山ビッグ愛","和歌山市手平２丁目１-２","BA555240","和歌山県","和歌山市","手平２丁目１-２","073-435-5200","073-435-5201","(会議室展示ホール)9:00〜21:00<br>(レストラン)8:30〜22:00<br>(宿泊施設)チェックイン14:00、チェックアウト10:00","地上１２階、地下１階","12/29〜1/3","◎一般駐車場　有り：乗用車用２８０台・バス５台・公用車２６台・健診車１４台<br>◎障害者用駐車場　有り：１０台","◎施設入口への車椅子利用：可<br>◎自動ドア　有り","◎誘導ブロック　有り<br>◎他の誘導設備：音声案内","◎一般案内　有り<br>◎点字案内　有り","◎一般用エレベーター　有り<br>◎障害者用エレベーター　有り（低位置操作盤・点字表示・音声案内）","◎障害者（車椅子）用便所　有り：１３箇所（１階３箇所・２階２箇所・３〜９階及び１２階各１箇所）<br>◎洋式大便所　有り：２７箇所<br>◎手すり付便所　有り：１３箇所","◎車椅子用電話　有り：６箇所","◎車椅子の常備　有り：５台<br>◎車椅子等に配慮した便所、浴室を完備した居室　有り：４室","◎障害者用トイレはもちろんのこと、扉は全て引戸に、各所に手摺りを設け、バリアフリーを実現しています。<br>◎宿泊施設には、車イスの方にも楽にお泊まりいただけるハンディキャップルーム（４室）を設けております。","その他","その他"
"大新公園地下駐車場","和歌山市坊主丁12","BA555241","和歌山県","和歌山市","坊主丁12","073-433-8768","073-433-8920","7:00〜2:00","地下１階","なし","◎一般駐車場　有り：１６２台<br>◎障害者用駐車場　有り：４台","◎施設入口への車椅子利用：可","","","◎一般用エレベーター　有り<br>◎障害者用エレベーター　有り（低位置操作盤・音声案内）","◎障害者（車椅子）用便所　有り：１箇所（施設入口付近）<br>◎手すり付便所　有り：２箇所","","","◎身障者用エレベーターで出入りできます。<br>◎身障者手帳を呈示すると、利用料金が５割引になります。","その他","その他"
"ＪＲ和歌山駅西口広場","和歌山市美園町5丁目13-2","BA555242","和歌山県","和歌山市","美園町5丁目13-2","","","","地上１階","","","◎施設入口への車椅子利用：可<br>◎自動ドア　有り","◎誘導ブロック　有り<br>◎他の誘導設備：音声案内","◎点字による案内　有り","◎一般用エレベーター　有り<br>◎障害者用エレベーター　有り（低位置操作盤・点字表示・音声案内）<br>◎エスカレーター　有り","◎障害者（車椅子）用便所　有り：１箇所（地下広場北側）<br>◎洋式大便所　有り：２箇所<br>◎手すり付便所　有り：１箇所<br>◎オストメイト対応便所　有り","","◎授乳室　有り：１室（障害者用便所内）","","その他","その他"
"JR広川ビーチ駅","有田郡広川町山本９７１-１","BA555938","和歌山県","有田郡広川町","山本９７１-１","","","終日","地上１階","なし","","◎施設入口への車椅子利用：可","◎誘導ブロック　有り","","","◎障害者（車椅子）用便所　有り：１箇所<br>◎洋式大便所　有り：１箇所<br>◎手すり付便所　有り：１箇所","","","","その他","その他"
"花の里児童公園","有田郡有田川町庄929-1","BA555939","和歌山県","有田郡有田川町","庄929-1","0737-52-5859","0737-52-8730","9:00〜17:00","","","◎一般駐車場　有り：５０台","","","","","◎障害者（車椅子）用便所　有り：１箇所（児童公園西側）","","","","その他","その他"
"四季の郷公園自然観察の森ネイチャーセンター","和歌山市明王寺58","BA555243","和歌山県","和歌山市","明王寺58","073-478-2220","073-478-2220","9:00〜16:30","地上１階","火曜","◎一般駐車場　有り：１７０台<br>◎障害者用駐車場　有り：５台","◎施設入口への車椅子利用：可","","◎一般案内　有り","","◎障害者（車椅子）用便所　有り：１箇所（入口すぐ）","","","","その他","その他"
"四季の郷公園四季さい館","和歌山市明王寺85","BA555244","和歌山県","和歌山市","明王寺85","073-478-2220","","9:00〜17:00","地上２階","火曜","◎一般駐車場　有り：１７０台<br>◎障害者用駐車場　有り：５台","◎施設入口への車椅子利用：可<br>◎自動ドア　有り","","◎一般案内　有り","◎一般用エレベーター　有り<br>◎障害者用エレベーター　有り（低位置操作盤・点字表示・音声案内）","◎障害者（車椅子）用便所　有り：２箇所（１階・２階）<br>◎洋式大便所　有り：２箇所<br>◎手すり付便所　有り：２箇所","","","◎おむつ替えシート付トイレが１・２階にある。","その他","その他"
"県民交流プラザ和歌山ビッグ愛","和歌山市手平2丁目1-2","BA555245","和歌山県","和歌山市","手平2丁目1-2","073-435-5200","073-435-5201","8:00〜23:00","地上１２階","年末、年始","◎一般駐車場　有り：２６０台<br>◎障害者用駐車場　有り：１０台","◎施設入口への車椅子利用：可<br>◎自動ドア　有り","◎誘導ブロック　有り<br>◎他の誘導設備：音声案内","◎一般案内　有り<br>◎点字案内　有り","◎一般用エレベーター　有り<br>◎障害者用エレベーター　有り（低位置操作盤・点字表示・音声案内）","◎障害者（車椅子）用便所　有り：14箇所(1階、2階各2箇所・3階〜12階各1箇所)<br>◎洋式大便所　有り<br>◎手すり付便所　有り：15箇所(1階3箇所・2階2箇所・3〜12階各1箇所)","","◎車椅子の常備　有り：６台<br>◎授乳室9階の女性センターで可能<br>◎キャッシュコーナー　有り（9:00〜18:00）<br>◎車椅子等に配慮した便所、浴室を完備した居室　有り：４室","","その他","その他"
"みちや味彩館（あじさいかん）","和歌山市加納203-4","BA555246","和歌山県","和歌山市","加納203-4","073-474-3500","なし","9:00〜24:00","地上１階","なし","◎一般駐車場　有り：１８台<br>◎障害者用駐車場　有り：１台","◎施設入口への車椅子利用：可<br>◎自動ドア　有り","◎誘導ブロック　有り","","","◎障害者（車椅子）用便所　有り：１箇所（店の横）<br>◎洋式大便所　有り：１箇所<br>◎手すり付便所　有り：１箇所","","","","その他","その他"
"和歌山農業協同組合西山東支店","和歌山市吉礼63-3","BA555247","和歌山県","和歌山市","吉礼63-3","073-478-0062","073-478-3735","8:30〜15:00","地上２階","土、日、祝日","◎一般駐車場　有り：５台<br>◎障害者用駐車場　有り：１台","◎施設入口への車椅子利用：可<br>◎自動ドア　有り","◎誘導ブロック　有り","","","◎障害者（車椅子）用便所　有り：１箇所（１階営業室内・来客職員兼用）<br>◎洋式大便所　有り：１箇所<br>◎手すり付便所　有り：１箇所","","","◎身障者等への対応は、その都度職員が行います。","その他","その他"
"紀ノ川セレモ平安","和歌山市福島111番地","BA555248","和歌山県","和歌山市","福島111番地","073-457-5969","073-452-4455","常時","地上３階","なし","◎一般駐車場　有り：２００台<br>◎障害者用駐車場　有り：１台","◎施設入口への車椅子利用：可<br>◎自動ドア　有り","◎誘導ブロック　有り","◎一般案内　有り","◎一般用エレベーター　有り<br>◎障害者用エレベーター　有り（低位置操作盤・点字表示・音声案内）","◎障害者（車椅子）用便所　有り：１箇所（１階ホール）<br>◎洋式大便所　有り：１５箇所","◎車椅子用電話　有り：１箇所","◎車椅子の常備　有り：１台","◎介護が必要な場合は、職員が対応します。","その他","その他"
"西庄ふれあいの郷ゲートゴルフ場","和歌山市西庄1107番地の33","BA555249","和歌山県","和歌山市","西庄1107番地の33","073-456-3566","","9:00〜21:00","地上１階","火曜日","◎一般駐車場　有り：５台<br>◎障害者用駐車場　有り：２台","◎施設入口への車椅子利用：可","","","","◎障害者（車椅子）用便所　有り：１箇所（入口正面）<br>◎洋式大便所　有り：１箇所<br>◎手すり付便所　有り：２箇所","◎車椅子用電話　有り：１箇所","","","その他","その他"
"西庄ふれあいの郷ハーブ園クラブハウス","和歌山市西庄字岩ノ谷1107-1","BA555250","和歌山県","和歌山市","西庄字岩ノ谷1107-1","073-456-3566","073-456-3566","9:00〜17:00","地上１階","火曜日","◎一般駐車場　有り：７台<br>◎障害者用駐車場　有り：２台","◎施設入口への車椅子利用：可<br>◎自動ドア　有り","◎誘導ブロック　有り","◎一般案内　有り","","◎障害者（車椅子）用便所　有り：１箇所（一般便所前）<br>◎洋式大便所　有り：男女各１箇所<br>◎手すり付便所　有り：男女各１箇所","","","◎障害者用便所からの非常呼び出しベルを設置しています。","その他","その他"
"信濃路紀ノ川店","和歌山市平井字前嶋147-1","BA555251","和歌山県","和歌山市","平井字前嶋147-1","073-480-3339","073-480-3339","11:00〜22:00","地上１階","なし","◎一般駐車場　有り：２５台","◎施設入口への車椅子利用：可<br>◎自動ドア　有り","◎誘導ブロック　有り","","","◎障害者（車椅子）用便所　有り：１箇所（ホール横）<br>◎洋式大便所　有り：２箇所","","◎車椅子の常備　有り：１台","","その他","その他"
"GAMELANDKCAT","和歌山市湊字中州坪1771-5","BA555252","和歌山県","和歌山市","湊字中州坪1771-5","073-480-5111","073-480-5112","10:00〜24:00","地上３階","なし","◎一般駐車場　有り：８４台<br>◎障害者用駐車場　有り：３台","◎施設入口への車椅子利用：可<br>◎自動ドア　有り","◎誘導ブロック　有り","◎一般案内　有り","◎一般用エレベーター　有り<br>◎障害者用エレベーター　有り（低位置操作盤）","◎障害者（車椅子）用便所　有り：１箇所（２階）<br>◎洋式大便所　有り：２箇所<br>◎手すり付便所　有り：２箇所","","","◎入口２ヶ所は年齢制限はありません。<br>◎障害者用便所内に、ベビーベッドを設置しています。","その他","その他"
"ウェディングヒルラヴィーナ和歌山(披露宴会場棟)","和歌山市中639-6","BA555253","和歌山県","和歌山市","中639-6","073-454-0010","073-454-7766","8:00〜22:00","地上２階","なし","◎一般駐車場　有り：１７０台<br>◎障害者用駐車場　有り：５台","◎施設入口への車椅子利用：可","","","◎一般用エレベーター　有り<br>◎障害者用エレベーター　有り（低位置操作盤）","◎障害者（車椅子）用便所　有り：２箇所（１階控室隣り、二階披露宴会場内）<br>◎洋式大便所　有り：３箇所<br>◎手すり付便所　有り：２箇所","","","◎駐車場は披露宴会場棟、及び、結婚式場棟兼用です。<br>◎披露宴会場入口側には５台の駐車場（障害者用２台含）があります。","その他","その他"
"ウェディングヒルラヴィーナ和歌山(結婚式場棟)","和歌山市中639-6","BA555254","和歌山県","和歌山市","中639-6","073-454-0010","073-454-7766","8:00〜22:00","地上３階、地下１階","なし","◎一般駐車場　有り：１７０台<br>◎障害者用駐車場　有り：５台","◎施設入口への車椅子利用：可","","","◎一般用エレベーター　有り<br>◎障害者用エレベーター　有り（低位置操作盤）","◎障害者（車椅子）用便所　有り：１箇所（１階待合室隣り）<br>◎洋式大便所　有り：２箇所<br>◎手すり付便所　有り：１箇所","","◎車椅子の常備　有り：１台（１階受付）","◎駐車場は結婚式場棟、及び、披露宴会場棟兼用です。","その他","その他"
"JR海南駅","海南市名高１８７-８","BA555535","和歌山県","海南市","名高１８７-８","073-482-0319","","","地上２階","なし","","◎施設入口への車椅子利用：可","◎誘導ブロック　有り","◎一般案内　有り","◎障害者用エレベーター　有り（低位置操作盤・点字表示・音声案内）<br>◎エスカレーター　有り","◎障害者（車椅子）用便所　有り：３箇所（外部用１箇所・駅構内２箇所）<br>◎洋式大便所　有り：１箇所<br>◎手すり付便所　有り：１箇所","","◎キャッシュコーナー　有り<br>◎点字付自動支払機　有り","","その他","その他"
"重根広場","海南市重根970-2","BA555536","和歌山県","海南市","重根970-2","","","24時間","地上１階","なし","◎一般駐車場　有り：２台<br>◎障害者用駐車場　有り：１台","◎施設入口への車椅子利用：可","◎誘導ブロック　有り","◎一般案内　有り","","◎障害者（車椅子）用便所　有り：１箇所<br>◎手すり付便所　有り：１箇所","","","","その他","その他"
"海南海草環境衛生センター","海南市築地1番地12","BA555537","和歌山県","海南市","築地1番地12","073-483-7030","073-483-7029","見学10:00〜14:00(要予約)","地上２階、地下１階","土・日・祭日","◎一般駐車場　有り：１９台<br>◎障害者用駐車場　有り：１台","◎施設入口への車椅子利用：可<br>◎自動ドア　有り","◎誘導ブロック　有り","◎一般案内　有り","◎一般用エレベーター　有り<br>◎障害者用エレベーター　有り（低位置操作盤・点字表示・音声案内）","◎障害者（車椅子）用便所　有り：１箇所（１階玄関ホール奥）<br>◎洋式大便所　有り：４箇所","","","◎施設の見学コースは、車椅子でも可能です。","その他","その他"
"(社)一峰会ぱん工房かたつむり","海南市重根1778","BA555538","和歌山県","海南市","重根1778","073-485-3320","073-485-3340","9:00〜15:30","地上２階","土・日・祝日","◎一般駐車場　有り：７台<br>◎障害者用駐車場　有り：１台","◎施設入口への車椅子利用：可<br>◎自動ドア　有り","◎誘導ブロック　有り","◎一般案内　有り<br>◎手話による案内　有り","◎一般用エレベーター　有り<br>◎障害者用エレベーター　有り（低位置操作盤・点字表示・音声案内）","◎障害者（車椅子）用便所　有り：１箇所（玄関ホール付近）<br>◎洋式大便所　有り：１箇所<br>◎手すり付便所　有り：２箇所","","◎車椅子の常備　有り：２台<br>◎車椅子用の浴室　有り<br>◎車椅子等に配慮した便所、浴室を完備した居室　有り：１室","","その他","その他"
"ビーンズこのの","橋本市神野々字西畑1152-1","BA555539","和歌山県","橋本市","神野々字西畑1152-1","0736-39-5377","0736-39-5311","10:00〜23:00","地上１階","不定休（月に２回程度）","◎一般駐車場　有り：６８０台<br>◎障害者用駐車場　有り：２台","◎施設入口への車椅子利用：可<br>◎自動ドア　有り","◎誘導ブロック　有り","","","◎障害者（車椅子）用便所　有り：１箇所（メイン入口ホール横）<br>◎洋式大便所　有り：４箇所<br>◎手すり付便所　有り：１箇所","","◎車椅子の常備　有り：２台（エントランスホール）","◎障害者来客用遊技スペースは有。店員が介助の上案内する。<br>◎駐車場は身体障害者マークの車輌が入ってきた場合、ガードマンが駐車スペースまで案内する。","その他","その他"
"田鶴苑（有田市デイサービスセンター）","有田市宮崎町911","BA555540","和歌山県","有田市","宮崎町911","0737-82-6644","0737-82-6609","8:30〜17:30","地上５階","日、年末年始","◎一般駐車場　有り：３０台","◎施設入口への車椅子利用：可<br>◎自動ドア　有り","","◎一般案内　有り","◎一般用エレベーター　有り<br>◎障害者用エレベーター　有り（低位置操作盤）","◎障害者（車椅子）用便所　有り：１０箇所","","◎車椅子の常備　有り：７０台（常時使用、空き１０台位）","◎車椅子用公衆電話はないが、カウンター上に設置され、車イス利用者も使用可。","その他","その他"
