"和歌山県立近代美術館","和歌山市吹上1-4-14","BA555059","和歌山県","和歌山市","吹上1-4-14","073-436-8690","073-436-1337","9:30〜17:00","地上２階、地下１階","月曜（祝祭日の場合翌日）、12/28〜1/4","◎一般駐車場　有り：９０台<br>◎障害者用駐車場　有り：３台","◎施設入口への車椅子利用：可<br>◎自動ドア　有り","◎誘導ブロック　有り","◎一般案内　有り<br>◎点字案内　有り","◎一般用エレベーター　有り<br>◎障害者用エレベーター　有り（低位置操作盤・点字表示・音声案内）<br>◎エスカレーター　有り","◎障害者（車椅子）用便所　有り：１箇所（１階）<br>◎洋式大便所　有り：３箇所<br>◎手すり付便所　有り：３箇所","◎公衆ＦＡＸ　有り","◎車椅子の常備　有り：３台","","文化施設","文化施設"
"和歌山市ふれ愛センター","和歌山市木広町５丁目1-9","BA555060","和歌山県","和歌山市","木広町５丁目1-9","073-433-8866","073-433-8868","9:00〜21:00","地上４階、地下１階","月曜","◎一般駐車場　有り：７台<br>◎障害者用駐車場　有り：４台","◎施設入口への車椅子利用：可<br>◎自動ドア　有り","◎誘導ブロック　有り<br>◎他の誘導設備：誘導の杖","◎一般案内　有り<br>◎手話による案内　有り<br>◎点字案内　有り","◎一般用エレベーター　有り<br>◎障害者用エレベーター　有り（低位置操作盤・点字表示・音声案内）","◎障害者（車椅子）用便所　有り：４箇所（各階）<br>◎洋式大便所　有り：３箇所<br>◎手すり付便所　有り：４箇所","◎車椅子用電話　有り<br>◎公衆ＦＡＸ　有り","◎車椅子の常備　有り：１０台","","文化施設","文化施設"
"和歌山県勤労福祉会館","和歌山市北出島１丁目69-1","BA555061","和歌山県","和歌山市","北出島１丁目69-1","073-425-3335","073-425-3337","9:00〜21:00","地上４階、地下１階","第２４の月曜","◎一般駐車場　有り：４０台<br>◎障害者用駐車場　有り：２台","◎施設入口への車椅子利用：可<br>◎自動ドア　有り","","◎一般案内　有り<br>◎点字案内　有り","◎一般用エレベーター　有り<br>◎障害者用エレベーター　有り（低位置操作盤・点字表示）","◎障害者（車椅子）用便所　有り：２箇所（１Ｆ、４Ｆ）","◎車椅子用電話　有り：１箇所","◎車椅子の常備　有り：１台","","文化施設","文化施設"
"和歌山県体力開発センター","和歌山市中之島2252","BA555062","和歌山県","和歌山市","中之島2252","073-431-7173","073-431-7175","（日祝）10:00〜19:00<br>（平日）10:00〜21:00","地上３階、地下１階","水曜","◎一般駐車場　有り：４４台","◎施設入口への車椅子利用：可<br>◎自動ドア　有り","◎誘導ブロック　有り","◎一般案内　有り","◎一般用エレベーター　有り","◎障害者（車椅子）用便所　有り：１箇所（１Ｆ）","","◎車椅子の常備　有り：１台","","文化施設","文化施設"
"和歌山県立体育館","和歌山市中之島2238","BA555065","和歌山県","和歌山市","中之島2238","073-422-4108","073-422-4109","9:00〜21:00","地上２階","水、年末年始","◎一般駐車場　有り：１３０台","◎施設入口への車椅子利用：可","","◎一般案内　有り","","◎障害者（車椅子）用便所　有り：２箇所（１Ｆ）","","◎車椅子の常備　有り：１台","","文化施設","文化施設"
"東部コミュニティセンター","和歌山市寺内665","BA555066","和歌山県","和歌山市","寺内665","073-475-0020","073-475-0022","9:00〜21:30","地上２階","金曜","◎一般駐車場　有り：６５台","◎施設入口への車椅子利用：可<br>◎自動ドア　有り","◎誘導ブロック　有り","◎一般案内　有り","◎一般用エレベーター　有り<br>◎障害者用エレベーター　有り（低位置操作盤・点字表示・音声案内）","◎障害者（車椅子）用便所　有り：２箇所（１階２階）<br>◎洋式大便所　有り：２箇所<br>◎手すり付便所　有り：２箇所","","◎車椅子の常備　有り：２台","","文化施設","文化施設"
"かつらぎ町ゆうゆうコミュニティホーム","伊都郡かつらぎ町妙寺146-2","BA555761","和歌山県","伊都郡かつらぎ町","妙寺146-2","0736-22-8191","","必要に応じて","地上２階","","◎一般駐車場　有り：５台","◎施設入口への車椅子利用：可","","","","◎障害者（車椅子）用便所　有り：１箇所（ホール廊下）","","","","文化施設","文化施設"
"かつらぎ町老人憩いの家","伊都郡かつらぎ町萩原79-1","BA555762","和歌山県","伊都郡かつらぎ町","萩原79-1","","","8:30〜17:15","地上２階","土、日、祝日","◎一般駐車場　有り：８台","◎施設入口への車椅子利用：可<br>◎自動ドア　有り","","","","◎障害者（車椅子）用便所　有り：１箇所（集会所横）","","◎車椅子の常備　有り：３台","","文化施設","文化施設"
"笠田ふるさと交流館","伊都郡かつらぎ町笠田東396-3","BA555765","和歌山県","伊都郡かつらぎ町","笠田東396-3","0736-22-1004","0736-22-1004","8:30〜17:15","地上２階","月、祝日","◎一般駐車場　有り：１７台<br>◎障害者用駐車場　有り：２台","◎施設入口への車椅子利用：可<br>◎自動ドア　有り","◎誘導ブロック　有り<br>◎他の誘導設備：手すり点字","◎一般案内　有り<br>◎点字による案内　有り","◎一般用エレベーター　有り<br>◎障害者用エレベーター　有り（低位置操作盤・点字表示・音声案内）","◎障害者（車椅子）用便所　有り：２箇所（廊下横）<br>◎洋式大便所　有り：１箇所<br>◎手すり付便所　有り：４箇所","","◎車椅子の常備　有り：１台（玄関ホール）","◎土、日曜に利用行事が無ければ休館になります。","文化施設","文化施設"
"かつらぎ体育センター","伊都郡かつらぎ町丁ノ町2530-10","BA555766","和歌山県","伊都郡かつらぎ町","丁ノ町2530-10","0736-22-6916","","8:30〜17:15","地上２階","月曜","◎一般駐車場　有り：１６台","◎施設入口への車椅子利用：可","","◎一般案内　有り","","◎障害者（車椅子）用便所　有り：１箇所（体育館内）<br>◎手すり付便所　有り：１箇所","","","","文化施設","文化施設"
"かつらぎ総合文化会館","伊都郡かつらぎ町丁ノ町2454","BA555767","和歌山県","伊都郡かつらぎ町","丁ノ町2454","0736-22-0303","0736-22-7102","9:00〜17:00","地上４階","月、祝日の翌日","◎一般駐車場　有り<br>◎障害者用駐車場　有り：２台","◎施設入口への車椅子利用：可<br>◎自動ドア　有り","","◎一般案内　有り","◎一般用エレベーター　有り<br>◎障害者用エレベーター　有り（低位置操作盤・点字表示）","◎障害者（車椅子）用便所　有り<br>◎洋式大便所　有り","◎公衆ＦＡＸ　有り","◎車椅子用観覧席　有り","","文化施設","文化施設"
"かつらぎ町丁ノ町会館","伊都郡かつらぎ町丁ノ町460-1","BA555768","和歌山県","伊都郡かつらぎ町","丁ノ町460-1","0736-22-6944","","8:30〜17:15","地上２階","土、日、祝日","◎一般駐車場　有り：１０台<br>◎障害者用駐車場　有り","◎施設入口への車椅子利用：可<br>◎自動ドア　有り","◎誘導ブロック　有り","◎一般案内　有り","","◎障害者（車椅子）用便所　有り：１箇所（ＷＣ内）<br>◎洋式大便所　有り<br>◎手すり付便所　有り","","","","文化施設","文化施設"
"かつらぎ町大谷公民館","伊都郡かつらぎ町大谷288-4","BA555769","和歌山県","伊都郡かつらぎ町","大谷288-4","0736-22-1644","","8:30〜17:15","地上２階","月曜日、祝日","","◎施設入口への車椅子利用：可","","","","◎障害者（車椅子）用便所　有り：１箇所（ＷＣ内）","","","","文化施設","文化施設"
"和歌山市立河南総合体育館","和歌山市和佐中165-1","BA555067","和歌山県","和歌山市","和佐中165-1","073-477-4009・4010","","9:00〜21:00","地上２階","火曜","◎一般駐車場　有り：１２０台<br>◎障害者用駐車場　有り：３台","◎施設入口への車椅子利用：可<br>◎自動ドア　有り","◎誘導ブロック　有り","◎一般案内　有り<br>◎点字案内　有り","","◎障害者（車椅子）用便所　有り：１箇所<br>◎洋式大便所　有り：１箇所","◎車椅子用電話　有り：１箇所","◎車椅子用観覧席　有り：３席","","文化施設","文化施設"
"和歌山市河南コミュニティセンター","和歌山市布施屋４１","BA555068","和歌山県","和歌山市","布施屋４１","073-477-6522","073-477-6533","9:00〜17:00","地上２階","毎週金曜日","◎一般駐車場　有り：５０台<br>◎障害者用駐車場　有り：３台","◎施設入口への車椅子利用：可<br>◎自動ドア　有り","◎誘導ブロック　有り<br>◎他の誘導設備：入口音声施設","◎一般案内　有り","◎一般用エレベーター　有り（低位置操作盤・点字表示・音声案内）","◎障害者（車椅子）用便所　有り：１箇所（１階WC）<br>◎洋式大便所　有り：２箇所<br>◎手すり付便所　有り：２箇所","◎車椅子用電話　有り","◎授乳室　有り（トイレ前）<br>◎車椅子の常備　有り","◎生涯学習の施設として福祉にも十分職員が対応できるよう心がけています。","文化施設","文化施設"
"和歌山県勤労福祉会館プラザホープ","和歌山市北出島１丁目5-47","BA555069","和歌山県","和歌山市","北出島１丁目5-47","073-425-3335","073-425-3337","9:00〜21:00","地上４階","第２４月曜日、年末年始","◎一般駐車場　有り：４０台","◎施設入口への車椅子利用：可<br>◎自動ドア　有り","","◎一般案内　有り","◎一般用エレベーター　有り<br>◎障害者用エレベーター　有り（低位置操作盤・点字表示・音声案内）","◎障害者（車椅子）用便所　有り：２箇所（１階、４階）<br>◎洋式大便所　有り：３箇所（女子のみ）","","◎車椅子の常備　有り","◎車イス等で来館される場合、事前に連絡があれば玄関前に駐車場を確保します。","文化施設","文化施設"
"社会福祉法人　安原福祉会「あいの里　悠々」","和歌山市松原115","BA555070","和歌山県","和歌山市","松原115","073-479-2500","","24時間","地上３階","なし","◎一般駐車場　有り：１１台","◎施設入口への車椅子利用：可<br>◎自動ドア　有り","","","◎障害者用エレベーター　有り（低位置操作盤・点字表示・音声案内）","◎障害者（車椅子）用便所　有り：３箇所<br>◎洋式大便所　有り：３箇所<br>◎手すり付便所　有り：３箇所","","","","文化施設","文化施設"
"知的障害者授産施設みなみ工房","和歌山市頭陀寺63","BA555071","和歌山県","和歌山市","頭陀寺63","073-478-3732","073-478-3739","8:30〜16:30","地上３階","土、日、祝日","◎一般駐車場　有り：９台<br>◎障害者用駐車場　有り：２台","◎施設入口への車椅子利用：可<br>◎自動ドア　有り","◎誘導ブロック　有り","◎一般案内　有り<br>◎点字による案内　有り","","◎障害者（車椅子）用便所　有り：１１箇所（１階）<br>◎手すり付便所　有り：９箇所","","◎車椅子用の浴室　有り","◎障害者において、やさしい対応をしています。","文化施設","文化施設"
"和歌山県立紀伊風土記の丘","和歌山市岩橋1411","BA555072","和歌山県","和歌山市","岩橋1411","073-471-6123","073-471-6120","9:00〜16:30","地上１階、地下ピロティー","月曜","◎一般駐車場　有り：８０台<br>◎障害者用駐車場　有り：１台","◎施設入口への車椅子利用：可<br>◎自動ドア　有り","◎誘導ブロック　有り","◎一般案内　有り","","◎障害者（車椅子）用便所　有り：１箇所（施設内）","◎公衆ＦＡＸ　有り","◎車椅子の常備　有り：３台","","文化施設","文化施設"
"杭ノ瀬文化会館","和歌山市杭ノ瀬76-7","BA555073","和歌山県","和歌山市","杭ノ瀬76-7","073-471-0433","073-474-5840","8:30〜17:15","地上２階","土午後、日、祝","◎一般駐車場　有り：18台<br>◎障害者用駐車場　有り：4台","◎施設入口への車椅子利用：可<br>◎自動ドア　有り","","◎一般案内　有り<br>◎点字案内　有り","◎障害者用エレベーター　有り（低位置操作盤・点字表示）","◎障害者（車椅子）用便所　有り：１箇所（２階）<br>◎洋式大便所　有り：２箇所<br>◎手すり付便所　有り：３箇所","","◎入口に利用者のみに聞こえるセンサー音があります。","","文化施設","文化施設"
"和歌山ビッグホエール","和歌山市手平2-1-1","BA555074","和歌山県","和歌山市","手平2-1-1","073-435-5200（管理センター）<br>073-433-0035","073-433-4181","9:00〜21:00","地上２階","火曜日","◎一般駐車場　有り：７００台<br>◎障害者用駐車場　有り：６台","◎施設入口への車椅子利用：可<br>◎自動ドア　有り","","◎一般案内　有り<br>◎点字案内　有り","◎障害者用エレベーター　有り（低位置操作盤・点字表示）","◎障害者（車椅子）用便所　有り：６箇所（１階×４箇所、２階×２箇所）<br>◎洋式大便所　有り：１２箇所","","◎車椅子の常備　有り：９台<br>◎観覧席　有り：１２席","","文化施設","文化施設"
"市民プール","和歌山市土入318-1","BA555075","和歌山県","和歌山市","土入318-1","073-455-8022","073-455-8023","4月〜9月:10:00〜20:00<br>10月〜3月:10:00〜18:00","地上２階","月曜","◎一般駐車場　有り：２００台<br>◎障害者用駐車場　有り：３台","◎施設入口への車椅子利用：可","◎誘導ブロック　有り","","","◎障害者（車椅子）用便所　有り：１箇所（１Ｆ）<br>◎洋式大便所　有り：箇所","","","","文化施設","文化施設"
"市民体育館","和歌山市土入318-1","BA555076","和歌山県","和歌山市","土入318-1","073-453-2007","073-453-2141","8:00〜17:00","地上１階","月曜","◎一般駐車場　有り：２００台<br>◎障害者用駐車場　有り：３台","◎施設入口への車椅子利用：可","◎誘導ブロック　有り","","","◎障害者（車椅子）用便所　有り：２箇所（１Ｆ）<br>◎洋式大便所　有り：２箇所","","","◎観覧席（車椅子用）はないが、必要に応じてスペースを設けている。","文化施設","文化施設"
"木本地区センター","和歌山市木本127-2","BA555077","和歌山県","和歌山市","木本127-2","073-455-0035","073-455-0035","8:30〜21:00","地上１階","土、日","","◎施設入口への車椅子利用：可","◎誘導ブロック　有り","","","◎障害者（車椅子）用便所　有り：１箇所","","","◎障害者用便所は別館にあり。","文化施設","文化施設"
"河西コミュニティセンター","和歌山市松江北2丁目20-7","BA555078","和歌山県","和歌山市","松江北2丁目20-7","073-480-1171","073-483-1172","9:00〜21:30","地上５階","金曜日","◎一般駐車場　有り：８０台<br>◎障害者用駐車場　有り：２台","◎施設入口への車椅子利用：可<br>◎自動ドア　有り","◎誘導ブロック　有り<br>◎他の誘導設備：誘導灯、手すり","◎一般案内　有り<br>◎点字による案内　有り","◎一般用エレベーター　有り<br>◎障害者用エレベーター　有り（低位置操作盤・点字表示）","◎障害者（車椅子）用便所　有り：４箇所（２３４５階）<br>◎洋式大便所　有り：男女各４箇所<br>◎手すり付便所　有り：男女各４箇所","◎車椅子用電話　有り：１箇所","◎車椅子の常備　有り：２台<br>◎授乳室　有り（２階）","","文化施設","文化施設"
"松江第１自治会館","和歌山市松江東１丁目1050","BA555079","和歌山県","和歌山市","松江東１丁目1050","073-451-8691","","利用時のみ","地上２階","なし","◎障害者用駐車場　有り：１台","◎施設入口への車椅子利用：可","","","","◎障害者（車椅子）用便所　有り：１箇所","◎車椅子用電話　有り：１箇所","","◎誘導点字ブロックはありませんが、入口明示ブロックがあります。","文化施設","文化施設"
"河北コミュニティーセンター","和歌山市市小路天王192-3","BA555080","和歌山県","和歌山市","市小路天王192-3","073-480-3610","073-453-6918","9:00〜21:30","地上２階","毎週金曜日（祝日の場合は翌日）","◎一般駐車場　有り：９７台<br>◎障害者用駐車場　有り：３台","◎施設入口への車椅子利用：可<br>◎自動ドア　有り","◎誘導ブロック　有り<br>◎他の誘導設備：音声誘導装置","◎一般案内　有り<br>◎点字による案内　有り","◎一般用エレベーター　有り<br>◎障害者用エレベーター　有り（低位置操作盤・点字表示・音声案内）","◎障害者（車椅子）用便所　有り：４箇所（１階中央、２階中央）<br>◎洋式大便所　有り：４箇所<br>◎手すり付便所　有り：４箇所","◎車椅子用電話　有り：１箇所","◎車椅子の常備　有り：３台（１階受付）","◎子供用便所も１ヶ所あります。","文化施設","文化施設"
"市小路会館","和歌山市市小路字乾角53-19","BA555081","和歌山県","和歌山市","市小路字乾角53-19","なし","なし","24時間可","地上１階","なし","◎一般駐車場　有り：２台","◎施設入口への車椅子利用：可","◎誘導ブロック　有り","","","◎障害者（車椅子）用便所　有り：１箇所<br>◎洋式大便所　有り：１箇所<br>◎手すり付便所　有り：１箇所","","","","文化施設","文化施設"
"和歌山セレモ平安","和歌山市手平5-1-23","BA555082","和歌山県","和歌山市","手平5-1-23","073-436-5969","073-436-5979","終日","地上２階","無し","◎一般駐車場　有り：１８０台<br>◎障害者用駐車場　有り：１台","◎施設入口への車椅子利用：可<br>◎自動ドア　有り","◎誘導ブロック　有り","","◎一般用エレベーター　有り<br>◎障害者用エレベーター　有り（低位置操作盤・音声案内）","◎障害者（車椅子）用便所　有り：１箇所（１階）<br>◎洋式大便所　有り：２箇所","","◎車椅子の常備　有り：１台","◎深夜は電話対応いたします。","文化施設","文化施設"
"市民憩の家ほうらい荘","和歌山市新和歌浦2-7","BA555083","和歌山県","和歌山市","新和歌浦2-7","073-445-9541","","9:00〜16:00","地上３階、地下２階","火曜（祝日の場合翌日）","◎一般駐車場　有り","◎施設入口への車椅子利用：可<br>◎自動ドア　有り","◎誘導ブロック　有り","◎一般案内　有り","◎一般用エレベーター　有り<br>◎障害者用エレベーター　有り（低位置操作盤・点字表示・音声案内）","◎障害者（車椅子）用便所　有り：４箇所（一般便所の中に有り）<br>◎手すり付便所　有り：４箇所","◎車椅子用電話　有り：１箇所","◎車椅子の常備　有り：２台","◎介護が必要な場合、職員が対応する。","文化施設","文化施設"
"かつらぎ町大谷会館","伊都郡かつらぎ町大谷868-1","BA555770","和歌山県","伊都郡かつらぎ町","大谷868-1","0736-22-1008","","8:30〜17:15","地上２階","土、日、祝日","◎一般駐車場　有り：３台","◎施設入口への車椅子利用：可<br>◎自動ドア　有り","◎誘導ブロック　有り","◎一般案内　有り","","◎障害者（車椅子）用便所　有り：１箇所（ＷＣ内）<br>◎洋式大便所　有り<br>◎手すり付便所　有り","","","","文化施設","文化施設"
"川上酒かつらぎ文化伝承館","伊都郡かつらぎ町丁ノ町字南通2470-1","BA555771","和歌山県","伊都郡かつらぎ町","丁ノ町字南通2470-1","0736-22-7840","なし","9:00〜17:00","地上２階","月曜日、祭日の翌日（但し、祭日・土・日曜日については事前申込が必要）","◎一般駐車場　有り：１５台","◎施設入口への車椅子利用：可<br>◎自動ドア　有り","◎誘導ブロック　有り","◎一般案内　有り","","◎障害者（車椅子）用便所　有り：１箇所","","","◎階段昇降機（ステアエイド）有り<br>◎車椅子便所１階","文化施設","文化施設"
"橋本市温水プール","橋本市高野口町向島135","BA555772","和歌山県","橋本市","高野口町向島135","0736-42-5077","0736-42-5798","火〜土1:00〜21:00<br>日・祝10:00〜19:00<br>夏10:00〜21:00<br>(7/21〜8/31)10:00〜19:00","地上２階、地下１階","月曜、12/28〜1/4","◎一般駐車場　有り：９台","◎施設入口への車椅子利用：可","◎誘導ブロック　有り","◎一般案内　有り","","◎洋式大便所　有り：２箇所","◎車椅子用電話　有り：１箇所","","","文化施設","文化施設"
"高野口産業文化会館","橋本市高野口町向島135","BA555773","和歌山県","橋本市","高野口町向島135","0736-42-5070","0736-42-5076","9:00〜21:30","地上３階","月曜、12/28〜1/4","◎一般駐車場　有り：１９３台","◎施設入口への車椅子利用：可<br>◎自動ドア　有り","◎誘導ブロック　有り","◎一般案内　有り","◎一般用エレベーター　有り<br>◎障害者用エレベーター　有り（低位置操作盤・音声案内）","◎障害者（車椅子）用便所　有り：３箇所（１階・２階・３階）<br>◎洋式大便所　有り：６箇所<br>◎手すり付便所　有り：２箇所（１階）","◎車椅子用電話　有り：１箇所","◎車椅子の常備　有り：１台<br>◎車椅子用観覧席　有り：５席","","文化施設","文化施設"
"高野口地区公民館","橋本市高野口町名倉813-2","BA555774","和歌山県","橋本市","高野口町名倉８１３番地の２","0736-33-3111","0736-43-0898","8:30〜21:30","地上２階","土、日、祝日、12/29〜1/3","◎一般駐車場　有り：４台","","","","","","","","","文化施設","文化施設"
"勤労者体育センター","田辺市芳養町108-4","BA555365","和歌山県","田辺市","芳養町108-4","0739-25-2531","0739-25-2531","8:00〜21:30","地上２階","年末年始（12/28〜1/4）","◎一般駐車場　有り：２５０台","◎施設入口への車椅子利用：可","","◎一般案内　有り","","◎障害者（車椅子）用便所　有り：１箇所（玄関横）","◎車椅子用電話　有り：１箇所","","","文化施設","文化施設"
"高野口町農業構造改善センター","橋本市上中168-8","BA555776","和歌山県","橋本市","上中168-8","なし","","","地上２階","","◎一般駐車場　有り：６台","◎施設入口への車椅子利用：可","","","","◎洋式大便所　有り：２箇所<br>◎手すり付便所　有り：１箇所","","","","文化施設","文化施設"
"伏原体育館","橋本市高野口町伏原806-1","BA555777","和歌山県","橋本市","高野口町伏原806-1","0736-33-2317（橋本市文化スポーツ振興公社）","","","地上２階","１２月２９日〜１月３日","◎一般駐車場　有り：４５台","◎施設入口への車椅子利用：可","","","","◎障害者（車椅子）用便所　有り：１箇所（１階）","","","","文化施設","文化施設"
"高野口町伏原教育集会所","橋本市高野口町伏原771-2","BA555778","和歌山県","橋本市","高野口町伏原771-2","0736-42-5640","","8:00〜22:00","地上１階","年中無休","◎一般駐車場　有り：１０台","","","","","","","","","文化施設","文化施設"
"伏原文化センター","橋本市高野口町伏原1077","BA555779","和歌山県","橋本市","高野口町伏原1077","0736-43-0978","","8:30〜17:15","地上２階","土、日、祝日、12/29〜1/3","◎一般駐車場　有り：２５台","◎施設入口への車椅子利用：可<br>◎自動ドア　有り","◎誘導ブロック　有り","","","◎洋式大便所　有り：１箇所<br>◎手すり付便所　有り","","◎車椅子の常備　有り：１台","","文化施設","文化施設"
